{
  "task_id": "cowork-evo/cowork-bench-fy2026-leadership-budget-review",
  "rubric_version": "visual-v1",
  "enabled": true,
  "reference_mode": "reference_free",
  "candidate_artifacts": [
    {
      "path": "budget_vs_actuals.pptx",
      "kind": "pptx",
      "label": "FY2026 预算与实际管理层简报"
    }
  ],
  "criteria": [
    {
      "criterion_id": "V001",
      "description": "第 1 页应以适合 CFO 季度管理层会议的克制层级呈现“FY2026 Budget vs Actuals”和“Quarterly Leadership Review - March 2026”，让标题、会议语境与页脚来源说明互不争抢。",
      "weight": 1.0,
      "score_anchors": {
        "0": "标题或会议语境难以辨认，装饰、字号或拥挤排版削弱管理层封面的正式感。",
        "0.5": "标题与副标题可读，但比例、留白、品牌装饰或页脚层级略显松散或普通。",
        "1": "标题是明确第一视觉焦点，副标题清楚交代时间和会议场景，少量品牌装饰与宽裕留白形成稳健的 CFO 汇报封面。"
      },
      "evidence_requirement": "指出第 1 页标题、副标题、右上图形和底部来源说明的相对尺寸、位置、对比及留白。"
    },
    {
      "criterion_id": "V002",
      "description": "第 2 页的 7 个部门、总预算、总实际与总差额应构成一眼可比较的总览，十位数美元金额仍须有稳定的列对齐、行节奏和清楚的表头层级。",
      "weight": 1.3,
      "score_anchors": {
        "0": "总览指标分散或金额拥挤、错位、裁切，管理层无法快速建立全局规模感。",
        "0.5": "四项指标基本可读，但长金额的对齐、行距、表头对比或总差额强调不足。",
        "1": "四项指标在统一表格中按标签和值稳定对齐，长金额不拥挤，表头、条纹行与来源说明支持快速横向和纵向扫描。"
      },
      "evidence_requirement": "引用第 2 页表头、四行指标、金额列和来源说明，说明长数字的可读性与比较节奏。"
    },
    {
      "criterion_id": "V003",
      "description": "第 3–9 页应以一致的左右对照结构呈现每个俄文部门的 Approved Plan 与 Salary Actuals；蓝色计划侧、青色实际侧、中央分隔线与底部状态带必须跨七页保持稳定映射。",
      "weight": 1.5,
      "score_anchors": {
        "0": "部门页的左右语义、颜色或组件位置跨页变化明显，计划与实际容易混淆。",
        "0.5": "多数部门页沿用同一结构，但局部颜色、列宽、标题位置或状态带节奏不一致。",
        "1": "七个部门页具有稳定的左右语义、蓝/青色义、中央分隔和底部状态带，翻页时无需重新学习版式。"
      },
      "evidence_requirement": "至少对比第 3、5、7、9 页的部门标题、左右列、分隔线和状态带，并说明跨页一致性。"
    },
    {
      "criterion_id": "V004",
      "description": "第 3–9 页每页的 Approved Budget、Headcount、Avg Salary、Actual Expenditure、Variance 与 Variance Pct 六项长数字应在会议投影尺度下完整、疏朗且易于跨栏配对，不被俄文部门名或来源页脚挤压。",
      "weight": 1.4,
      "score_anchors": {
        "0": "多项金额、人数或百分比发生裁切、重叠或字号过小，无法在投影场景可靠读取。",
        "0.5": "六项数字均可见，但部分长金额行距偏紧、左右配对弱或个别部门页留白失衡。",
        "1": "六项指标在七页中均保持完整大号文本、清楚行距和稳定左右配对，部门名、状态与来源不会干扰数字阅读。"
      },
      "evidence_requirement": "检查第 3–9 页的六项指标是否完整显示，特别指出最长金额、两位小数百分比、俄文标题和页脚之间的空间关系。"
    },
    {
      "criterion_id": "V005",
      "description": "第 10 页应将 НИОКР 的最大结余与 Операции 的最小结余作为两个并列极值清楚比较，同时用“All 7 departments are under budget”状态带消除“Most Over Budget”标题可能造成的视觉误读。",
      "weight": 1.4,
      "score_anchors": {
        "0": "两组极值混排或状态结论缺失、被遮挡，使页面看起来像有部门真正超预算。",
        "0.5": "两组极值和全员低于预算的结论均可见，但标题、数据与状态带的主次不足以迅速化解歧义。",
        "1": "左右极值采用明确并列结构，部门与三项金额逐行对应，底部全员低于预算结论醒目地限定右侧“Most Over Budget”的相对含义。"
      },
      "evidence_requirement": "指出第 10 页左右标题、两个俄文部门、三项金额和底部状态带的视觉关系，判断是否会误读为实际超预算。"
    },
    {
      "criterion_id": "V006",
      "description": "整套 10 页应形成“深色封面—总览—七页部门下钻—极值总结”的管理层叙事节奏；白色数据页的留白、字体、蓝/青强调和来源页脚须整体一致且不显得像未完成模板。",
      "weight": 1.2,
      "score_anchors": {
        "0": "页面风格或阅读顺序割裂，部门页重复但失控、留白极端或来源说明干扰主体，整体不具备交付感。",
        "0.5": "叙事顺序完整且风格基本统一，但连续部门页过度空泛、节奏单调或个别页的留白与强调失衡。",
        "1": "四段式叙事清楚，重复部门页保持稳定而非凌乱，封面与数据页在字体、蓝/青色和页脚上形成统一、克制的 CFO 交付语言。"
      },
      "evidence_requirement": "综合比较第 1、2、3–9、10 页的背景、标题、强调色、留白、状态带和来源页脚，说明全稿叙事与交付一致性。"
    }
  ]
}
