{
  "task_id": "cowork-evo/officebench-3-5-invoice-payment-trends-briefing",
  "rubric_version": "visual-v1.1",
  "enabled": true,
  "reference_mode": "reference_free",
  "candidate_artifacts": [
    {
      "path": "January_2023_Invoice_Payment_Review.pptx",
      "kind": "pptx",
      "label": "2023 年 1 月发票支付复核简报"
    }
  ],
  "criteria": [
    {
      "criterion_id": "V001",
      "description": "第 1 页应把“两张发票、一个编号冲突”作为首要判断，并用 Total Due、Largest Invoice、29-day span、#100 ×2 四项指标构成从金额到身份风险的清楚层级；无付款状态证据须醒目但不能抢过标题。",
      "weight": 1.4,
      "score_anchors": {
        "0": "核心判断或金额/编号信息不可读、互相遮挡，无法理解本次复核对象与主要风险。",
        "0.5": "标题和四项指标可读，但主卡与三张次卡比例、颜色、留白或边界声明层级不够稳定。",
        "1": "编号冲突主标题先被看到，总额主卡与三项诊断卡按清楚顺序展开，付款状态边界和来源保持可读的次级位置。"
      },
      "evidence_requirement": "指出第 1 页两行标题、右上总额卡、底部三卡、付款状态边界和来源行的具体位置、间距与阅读顺序。"
    },
    {
      "criterion_id": "V002",
      "description": "第 2 页两行、十一列 Invoice Register 应在横向空间内保持可追踪的表头、行带和字段对齐；下方 Cloud/Pottery 两张来源卡及红色重复编号提示应帮助解释表格，而不是制造拥挤。",
      "weight": 1.6,
      "score_anchors": {
        "0": "表格列头或关键字段被裁切/重叠，无法逐行辨认两张发票，或下方卡片覆盖表体。",
        "0.5": "两行数据基本可读，但十一列过密、长客户/描述换行失控、金额列错位或提示区主次不清。",
        "1": "十一列通过合理列宽和斑马纹保持逐字段核对，长字段完整，来源卡清楚补充条款/供应商信息，重复 #100 提示独立收口。"
      },
      "evidence_requirement": "检查第 2 页 Source 至 Total due 的十一列表头、两行长字段与金额、下方两张来源卡、红色唯一键提示和页脚。"
    },
    {
      "criterion_id": "V003",
      "description": "第 3 页堆积柱图应在巨大金额差异下仍让 Cloud service 与 Decorative clay pottery 的 Subtotal、Tax、Shipping 三段可辨，并与右侧三个汇总金额卡和 93%/7% 结论形成一致的证据层级。",
      "weight": 1.5,
      "score_anchors": {
        "0": "柱、分段或标签遮挡到至少一个金额无法辨认，两张发票的构成关系不可恢复，或汇总卡覆盖图表。",
        "0.5": "两根柱与全部金额仍可辨认，但任意两个数字标签相互接触/重叠，或小额分段只能依赖图例猜读；出现这一情况即按本档，不因总量正确升档。",
        "1": "两根柱清楚表达数量级差，每个数字标签与相邻标签至少留出约一个文字高度，三段颜色可独立追踪，右侧三卡和 93%/7% 结论清楚收口。"
      },
      "evidence_requirement": "指出第 3 页两根堆积柱、99.99/4.99/1300/65/24.99 标签、图例、长类目名、三张汇总卡和占比结论。"
    },
    {
      "criterion_id": "V004",
      "description": "第 4 页必须用顶部 2/2 Terms、0/2 Payment Records、29 days 三张卡先区分条款与状态，再用两行控制表和底部警示框完成核对；红色只能承担缺失证据和禁止断言的风险语义。",
      "weight": 1.5,
      "score_anchors": {
        "0": "三卡、表格或警示框相互覆盖，Terms 与 Payment status 无法区分，或风险色义混乱。",
        "0.5": "内容均在，但表格列宽、卡片密度、风险提示字号/换行或上下间距不够清楚。",
        "1": "三张指标卡建立边界，六列表可逐行核对条款与 Not provided，红色警示框清楚说明禁止断言且与来源保持安全间距。"
      },
      "evidence_requirement": "检查第 4 页三张卡、六列表的 Terms/Payment status 两列、红色边界提示和来源行的对齐、间距与颜色语义。"
    },
    {
      "criterion_id": "V005",
      "description": "第 5 页应以“Resolve identity before payment”为主标题，四条编号控制按顺序呈现动作和理由，右侧 Review Boundary 清楚分开 Known 与 Unknown；标题、第一条控制和边界卡不得重叠。",
      "weight": 1.6,
      "score_anchors": {
        "0": "主标题无法完整辨认，或至少两条动作/一整个 Known 或 Unknown 区域不可读，无法作为可执行的复核收口页。",
        "0.5": "完整标题仍可根据可见文字辨认，但任一标题行被第一张动作卡接触、压住或裁切；或四条动作都可读但长文本明显拥挤。出现标题与首卡接触即按本档。",
        "1": "完整主标题全部露出，标题边界与第一张动作卡之间至少保留约一个正文行高；四条编号动作等距且动词醒目，右侧 Known/Unknown 清楚分区。"
      },
      "evidence_requirement": "指出第 5 页完整标题、四张动作卡及编号、右侧 Review Boundary、No external assumptions 和页脚之间是否存在覆盖或拥挤。"
    },
    {
      "criterion_id": "V006",
      "description": "整套 5 页应形成“冲突概览—逐字段登记—金额构成—条款/状态边界—控制行动”的财务复核故事，并在深浅页面节奏、紫/橙/青/红语义色、字体、页码与来源位置上保持专业一致。",
      "weight": 1.3,
      "score_anchors": {
        "0": "五页像独立模板拼接，颜色含义、标题系统或来源位置频繁跳动，整体无法直接用于财务复核会议。",
        "0.5": "叙事顺序成立且基本统一，但个别页密度、配色、页脚或首尾呼应明显不稳。",
        "1": "深色首尾包围三张浅色证据页，四种强调色始终对应固定语义，标题、表图、页码和来源系统连贯，整体可直接演示。"
      },
      "evidence_requirement": "综合比较第 1–5 页背景切换、强调色角色、标题、表格/图表/卡片、页码和来源行的一致性与节奏。"
    }
  ]
}
