{
  "task_id": "cowork-evo/pptarena-059-two-url-clickable-hyperlinks",
  "rubric_version": "visual-v1",
  "enabled": true,
  "reference_mode": "reference",
  "candidate_artifacts": [
    {
      "path": "ConvertHyperLink_GroundTruth.pptx",
      "kind": "pptx",
      "label": "仅为两个指定 URL 添加可点击链接后的户外主题单页演示文稿"
    }
  ],
  "reference_artifacts": [
    {
      "path": "solution/Golden/ConvertHyperLink_GroundTruth.pptx",
      "kind": "pptx",
      "label": "已核验的双 URL 超链接与页面保持视觉参考文稿"
    }
  ],
  "criteria": [
    {
      "criterion_id": "V001",
      "description": "页面下方的完整句子 `Visit https://www.berkeley.edu/ and https://illinois.edu/ for more details` 必须清楚呈现；视觉链接样式只能落在两个 URL 字符串上，`Visit`、`and` 与 `for more details` 应保持普通正文外观，不能出现整句都像链接或 URL 与周围文字难以区分的情况。",
      "weight": 2.4,
      "score_anchors": {
        "0": "句子缺失、明显改写或裁切，或者整句/非 URL 文字都呈现链接样式，读者无法辨认两个独立链接范围。",
        "0.5": "完整句子可读且两个 URL 大致可辨，但下划线、颜色或字符覆盖存在一处明显越界/遗漏，链接范围需要仔细辨认。",
        "1": "整句逐字清楚，两个 URL 以一致而克制的链接样式准确突出，前后普通文字视觉上明确不属于链接。"
      },
      "evidence_requirement": "逐段读取 Visit、Berkeley URL、and、Illinois URL 和 for more details，说明每段的颜色/下划线外观以及两个视觉链接范围是否准确。"
    },
    {
      "criterion_id": "V002",
      "description": "链接句应保持原稿的单行排版与小号正文层级，位于左下标题下方的安全区；文字基线、单词间距与 URL 间隔应自然，不得换行、挤压、重叠、贴边或侵入右侧背包插画。",
      "weight": 1.8,
      "score_anchors": {
        "0": "句子发生多行断裂、严重压缩/重叠、超出页面或与背包插画相撞，主要内容不可正常阅读。",
        "0.5": "句子仍可读且未越界，但基线、字距、留白或左右位置明显偏离参考，视觉上显得拥挤或松散。",
        "1": "句子保持流畅单行、基线平稳、间距均匀，与标题和右侧插画之间均有自然留白。"
      },
      "evidence_requirement": "检查整句是否单行，比较其上下到主标题、左右到页面边缘和背包插画的距离，并报告换行、碰撞、裁切或异常字距。"
    },
    {
      "criterion_id": "V003",
      "description": "浅蓝户外主题背景必须完整保持：淡色地图/云纹的构图位置、左上 Logo、顶部 HOME/ABOUT/SERVICE/CONTACT 导航、右上装饰线和右侧背包都应与参考一致，不得因背景图移动而出现地图纹样错位或边缘裁切变化。",
      "weight": 2.5,
      "score_anchors": {
        "0": "背景或关键品牌/插画元素明显缺失、重排、严重裁切，页面已不是原有户外模板构图。",
        "0.5": "Logo、导航和背包仍完整，但地图/云纹或某个边缘装饰有清楚可见的位移、裁切或比例变化。",
        "1": "背景地图/云纹、Logo、导航、右上装饰与背包的位置、比例和边缘裁切均与参考稳定一致。"
      },
      "evidence_requirement": "分别对照左上 Logo、四项导航、淡色地图轮廓、右上斜线和背包四周边缘，指出任何位置、缩放或裁切差异。"
    },
    {
      "criterion_id": "V004",
      "description": "页面视觉层级必须保持原设计：深灰大写主标题仍是第一视觉焦点，背包插画作为右侧平衡，链接句作为次级行动信息；标题、图像和链接句之间不得出现异常抢色、失衡或新的视觉噪声。",
      "weight": 1.8,
      "score_anchors": {
        "0": "主标题或背包被遮挡/替换，或者链接句异常放大、强色抢占主视觉，原有层级失效。",
        "0.5": "三层信息仍可识别，但某处字号、颜色、相对位置或背景位移使左右平衡和阅读顺序明显变弱。",
        "1": "主标题、背包和链接句形成清楚的主—辅—行动层级，左右平衡稳定，颜色克制且阅读顺序自然。"
      },
      "evidence_requirement": "从整页第一眼焦点出发描述主标题、右侧背包和底部链接句的阅读顺序，并检查是否出现抢色、遮挡或构图失衡。"
    },
    {
      "criterion_id": "V005",
      "description": "最终页面应像对既有文稿完成的一次干净微编辑：除两个 URL 的合理链接样式外，不应出现额外文字、空框、选中框、调试标记、图片替换、像素化、渲染破损或其他无关改动。",
      "weight": 1.5,
      "score_anchors": {
        "0": "出现明显调试/答案文字、空白/损坏区域、图片替换或多处无关编辑，页面不可直接交付。",
        "0.5": "页面主体完整可用，但存在一处肉眼可见的无关改动、轻微渲染瑕疵或边缘清理问题。",
        "1": "整页干净完整，除两个 URL 的链接外观外看不出无关编辑，可直接用于演示。"
      },
      "evidence_requirement": "总览整页并检查额外文字/框线、调试痕迹、图片清晰度、边缘裁切和渲染异常，明确列出所见无关变化。"
    }
  ]
}
