{
  "task_id": "cowork-evo/pptarena-015-bold-all-slide-titles",
  "rubric_version": "visual-v1",
  "enabled": true,
  "reference_mode": "reference",
  "candidate_artifacts": [
    {
      "path": "Bolded_BoldTitleTestB.pptx",
      "kind": "pptx",
      "label": "11 页人工智能课程中每页主标题均设为粗体的交付"
    }
  ],
  "reference_artifacts": [
    {
      "path": "solution/Golden/Bolded_BoldTitleTestB.pptx",
      "kind": "pptx",
      "label": "PPTArena 人工完成全部主标题粗体编辑的参考交付"
    }
  ],
  "criteria": [
    {
      "criterion_id": "V001",
      "description": "第 1–11 页每页主标题应呈现与参考一致的粗体字重，并在极简封面、常规列表页、密集多行标题页中都与正文形成稳定层级。",
      "weight": 2.8,
      "score_anchors": {
        "0": "多张页面的主标题仍明显为非粗体，或字重比参考显著更轻、与正文层级混淆。",
        "0.5": "大多数页的主标题均已加粗，但仍有一至两页字重不一、多行标题只部分加粗，或标题层级与参考明显不符。",
        "1": "11 页的主标题都与参考一样完整呈现粗体，包括封面 `CSE1300` 和第 6、7、8、9、11 页的多行标题。"
      },
      "evidence_requirement": "逐页对照 11 页联系图，并放大抽查封面、第 2、6、8、9、11 页，报告主标题整体字重、多行一致性及与正文的层级。"
    },
    {
      "criterion_id": "V002",
      "description": "第 1 页应只把上方主标题 `CSE1300` 处理为粗体；中部课程副标题 `Introduction to Artificial Intelligence (AI)` 和右下校徽的视觉样式、位置与留白应与参考相同。",
      "weight": 2.3,
      "score_anchors": {
        "0": "`CSE1300` 仍明显未加粗，或课程副标题/校徽被删除、重排、遮挡或显著改样。",
        "0.5": "封面语义目标正确且内容可读，但主标题字重、副标题样式、居中或纵向留白与参考有明显可见差异。",
        "1": "封面与参考一致：`CSE1300` 粗体清晰，课程副标题保持原样，两者居中层级、间距、页面留白和右下校徽均未被扰动。"
      },
      "evidence_requirement": "单独放大对照第 1 页，分别报告 `CSE1300`、课程副标题、校徽及三者间留白的变化情况。"
    },
    {
      "criterion_id": "V003",
      "description": "加粗后的主标题应保持原文、字号、对齐和文本框边界，不应导致长标题新增不自然换行、截断、离页，或与下方项目符号发生新的重叠。",
      "weight": 2.2,
      "score_anchors": {
        "0": "任一主标题被截断/离页，或多页标题与正文发生明显重叠、严重压缩内容区。",
        "0.5": "全部标题可读，但某些多行标题的换行、边距、行距或与第一条正文的间隔比参考明显粗糙。",
        "1": "第 6、7、8、9、11 页的多行/长标题均与参考保持相同换行、左对齐、顶边距和与正文间距，不见新的裁切或遮挡。"
      },
      "evidence_requirement": "放大检查第 6、7、8、9、11 页标题区，报告换行、左对齐、顶边距、文本框容纳和与正文间隔。"
    },
    {
      "criterion_id": "V004",
      "description": "黑金双边框、右下 Kennesaw State University 校徽、所有正文/项目符号和页面空间应与参考保持一致，不应出现因主标题操作产生的重设计、遮罩、截图、备注或调试元素。原输入已有的某些正文与右下校徽靠近/重叠不在本项重复扣分，除非候选比参考进一步恶化。",
      "weight": 2.7,
      "score_anchors": {
        "0": "多页正文、边框或校徽丢失/明显移位，或出现大面积遮罩、截图、备注和非交付元素。",
        "0.5": "11 页齐全且主内容保留，但部分正文对齐、边框、校徽位置或留白比参考有新的明显可见变化。",
        "1": "候选与参考的 11 页联系图逐页对应，黑金边框、校徽、正文、项目符号和留白均未出现新变化，不见工作痕迹。"
      },
      "evidence_requirement": "对照 11 页联系图，报告边框、校徽、正文/项目符号、留白和工作痕迹；只记录相比参考新增或恶化的问题。"
    }
  ]
}
