{
  "task_id": "cowork-evo/officeval-054-image-to-editable-water-reuse-process",
  "rubric_version": "visual-v1",
  "enabled": true,
  "reference_mode": "reference",
  "candidate_artifacts": [
    {
      "path": "industrial_water_reuse_editable_process.pptx",
      "kind": "pptx",
      "label": "工业园中水回用可编辑流程图"
    }
  ],
  "reference_artifacts": [
    {
      "path": "solution/Golden/industrial_water_reuse_editable_process.pptx",
      "kind": "pptx",
      "label": "12.44×7.00 cm 工业水处理流程参考交付"
    }
  ],
  "criteria": [
    {
      "criterion_id": "V001",
      "description": "指定的 12.44×7.00 cm 流程图应作为一个完整组合水平、垂直居中于 16:9 白色幻灯片，保留大量四周留白；深青标题条、白色主体外框和底部保障栏必须在同一小型画布中稳定对齐。",
      "weight": 1.5,
      "score_anchors": {
        "0": "流程图不居中、被拉伸/放大到失去指定尺寸，或标题条、主体、底栏断裂。",
        "0.5": "整体居中且组成齐全，但组合框比例、标题条宽度、主体圆角或四周留白对称性明显偏离参考。",
        "1": "小型流程画布严格居中，深青标题条、主体框和底栏宽度统一，四周大留白均衡，没有误将指定尺寸视为缺陷。"
      },
      "evidence_requirement": "在整页视图中指出流程图四边至幻灯片的留白、标题条与主体/底栏对齐，并确认这是用户指定的居中小尺寸图。"
    },
    {
      "criterion_id": "V002",
      "description": "主体中的 10 个竖向处理步骤应在浅蓝灰相间色带上等宽、等高、等间距排列；青色编号圆与逐字换行的宋体步骤名不相压，9 段深蓝右向箭头须沿同一中线连续通过。",
      "weight": 2.0,
      "score_anchors": {
        "0": "多个步骤不可辨/重叠，编号和步骤顺序断裂，或箭头无法从 1 追踪到 10。",
        "0.5": "10 个步骤齐全且顺序正确，但竖排字距、编号圆位置、窄框等宽性、交替色带或箭头中线有明显偏差。",
        "1": "从“厂区综合废水收集”到“冷却补水系统”的十步节奏高度一致，第 8 步清晰为“消毒接触池”，编号、色带、箭头均整齐可读。"
      },
      "evidence_requirement": "从左到右逐个核查 1–10 号圆、竖排步骤名、窄圆角框、交替色带和 9 个水平箭头，特别引用第 8 步。"
    },
    {
      "criterion_id": "V003",
      "description": "步骤 3、4、7、8 下方应分别安放“酸碱调节”、“PAC/PAM投加”、“核心净化单元”、“次氯酸钠投加”四个浅绿说明框，烧瓶/水滴/护盾等可编辑图标与短文字不挤压，青色竖向虚线箭头精确对准对应步骤。",
      "weight": 1.4,
      "score_anchors": {
        "0": "多个辅助框/图标缺失或文字严重裁切，虚线指向错误步骤。",
        "0.5": "四个说明基本齐全，但框宽、图标与文字间隔、深浅对比、虚线端点或与上方步骤的对齐有明显粗糙。",
        "1": "四个说明框均居于对应步骤下方，图标、文字和浅绿底色清楚，四条虚线上指且不穿过正文。"
      },
      "evidence_requirement": "检查四个辅助框的文本、图标、底色、宽度以及到第 3/4/7/8 步的虚线箭头端点。"
    },
    {
      "criterion_id": "V004",
      "description": "异常回流和回用分支应在主流程下方形成可区分的两条路径：第 9 步下行进入“绿化与冲洗回用”叶片框，深蓝折线另从第 9 步向左延伸并上返第 2 步，“异常回流”标签置于管线中段且不压线/压字。",
      "weight": 1.7,
      "score_anchors": {
        "0": "回流或绿化分支缺失/断裂，箭头指向不明，无法理解异常水回到哪一步。",
        "0.5": "两条路径都在，但折线水平度、转角、上返/下行箭头端点、标签居中或叶片框留白明显偏差。",
        "1": "第 9 步向下分支和向左回流两条路径互不混淆，深蓝线型连续，标签、叶片图标和起止点都清晰。"
      },
      "evidence_requirement": "指出第 9 步下行线、绿化/冲洗回用框与叶片，以及从第 9 步横向左行、上返第 2 步的整条异常回流线。"
    },
    {
      "criterion_id": "V005",
      "description": "底部浅蓝保障栏应由三条青色虚线等分为四段，每段分别以护盾加号、剪贴板、齿轮、文档图标配合一行深蓝主文字和一行灰色说明；小字在指定 12.44 cm 宽度下仍须尽可能完整可辨。",
      "weight": 1.5,
      "score_anchors": {
        "0": "底栏缺失/被裁切，多个图标或主副文字不可辨，四段保障信息无法区分。",
        "0.5": "四段内容齐全，但分割不均、图标大小/对齐、主副文字基线、字号或对比度有明显问题。",
        "1": "四段保障模块等宽，四种图标可辨且统一，深蓝主文字和灰色副文字层级明确，与上方回流线保持间隔。"
      },
      "evidence_requirement": "从左到右检查四个图标、四组主副文字、三条虚线分隔和底栏上下边距。"
    },
    {
      "criterion_id": "V006",
      "description": "在指定的小尺寸流程图内，宋体文字、0.75 磅线条、深青/青绿/深蓝/浅蓝灰配色和所有圆角/图标应保持一致；不得出现步骤字与编号冲突、辅助文字溢出、线穿字或局部低对比。",
      "weight": 1.9,
      "score_anchors": {
        "0": "小尺寸下多处正文/编号不可读，线条与文字严重冲突，或配色和字体系统混乱。",
        "0.5": "流程可理解且大部分内容可读，但若干辅助标签、底栏小字、竖排字距、箭头或图标在渲染中明显过密/粗糙。",
        "1": "尽管全图仅 12.44×7.00 cm，标题、十步、辅助说明、分支和底栏仍层级分明，字体/线宽/颜色统一，无明显遮挡。"
      },
      "evidence_requirement": "放大查看整个 12.44 cm 宽流程区，点名任何字符裁切、竖排字冲突、图标变形、线穿字或对比不足，不得只因四周大留白扣分。"
    }
  ]
}
