{
  "task_id": "cowork-evo/pptarena-047-line-to-clustered-column-chart",
  "rubric_version": "visual-v1",
  "enabled": true,
  "reference_mode": "reference",
  "candidate_artifacts": [
    {
      "path": "ChangeLineGraphtoBar_GroundTruthA.pptx",
      "kind": "pptx",
      "label": "将成人识字率折线图转换为簇状柱形图后的单页演示文稿"
    }
  ],
  "reference_artifacts": [
    {
      "path": "solution/Golden/ChangeLineGraphtoBar_GroundTruthA.pptx",
      "kind": "pptx",
      "label": "已核验的簇状柱形图视觉参考文稿"
    }
  ],
  "criteria": [
    {
      "criterion_id": "V001",
      "description": "中央图表应清楚呈现为单系列的竖向簇状柱形图：IALS 1994、ALL 2003、PIAAC 2012/2014 各对应一根独立柱，三柱宽度一致、底边齐平、间距均衡；不得残留折线、点标记、水平条形、堆积效果、图例或图表标题。",
      "weight": 2.5,
      "score_anchors": {
        "0": "视觉上仍是折线/横条/堆积图，柱数错误，或多余图例/标题显著干扰图表语义。",
        "0.5": "能认出三根竖向独立柱，但柱宽、间距、对齐或残余图形元素存在明显不一致。",
        "1": "三根竖向柱清楚独立、等宽齐底且均匀分布，没有折线残留、堆积感、图例或图表标题。"
      },
      "evidence_requirement": "逐一指出三根柱对应的分类，检查柱向、柱宽、柱间距、底边和是否存在折线/标记/图例/图表标题。"
    },
    {
      "criterion_id": "V002",
      "description": "图表读数必须一眼可核对：三根柱上方的数据标签分别应显示约 `273`、`268*`、`272`，分类标签完整，纵轴应从 245 到 285、以 10 为主刻度，使三次调查的细微差异既可见又不过度夸张。",
      "weight": 2.4,
      "score_anchors": {
        "0": "两个以上数据标签/分类不可读或读数冲突，纵轴范围使柱形关系严重误导或无法判断。",
        "0.5": "主要数据与分类能读出，但有一处标签位置/星号/刻度不清，或轴范围偏移导致差异被明显放大或压缩。",
        "1": "273、268*、272 与三个分类全部清晰；245/255/265/275/285 刻度稳定，柱高关系与标题陈述直观一致。"
      },
      "evidence_requirement": "读取三根柱的数据标签、三个横轴分类和纵轴全部刻度，说明 1994≈2012/2014 且二者高于 2003 的关系是否被忠实呈现。"
    },
    {
      "criterion_id": "V003",
      "description": "柱形图的视觉样式应简洁、适合教育统计汇报：柱色统一且与页面蓝色强调色协调，网格线足够轻，数据标签与柱顶有合理间隔；不得出现过粗边框、强烈渐变、阴影、3D 效果或装饰性噪声。",
      "weight": 1.8,
      "score_anchors": {
        "0": "图表样式强烈杂乱或失真，装饰效果压过数据，标签与柱/网格线大面积冲突。",
        "0.5": "图表可用，但柱色、网格线、标签间距或边框有一到两处明显粗糙，专业感一般。",
        "1": "统一蓝柱、轻网格和清楚标签形成克制的统计图表，颜色与页面强调色连贯且没有多余装饰。"
      },
      "evidence_requirement": "描述柱色、网格线、标签到柱顶的间距、边框/阴影/3D 状态以及它们与标题蓝色边框和 AIR 品牌色的协调性。"
    },
    {
      "criterion_id": "V004",
      "description": "图表应保留在标题下、页脚上的主体区域，尺寸足以阅读且不触碰灰底标题框、AIR Logo、页码或显著性注释；图表与页边、标题和页脚之间应有稳定留白，不能被裁切或显得过小/过大。",
      "weight": 1.7,
      "score_anchors": {
        "0": "图表越界/裁切或明显遮挡标题、Logo、页码、注释，主体布局不可用。",
        "0.5": "图表内容可读且未遮挡，但宽高、对齐或上下留白明显失衡，显得挤压或松散。",
        "1": "图表在主体区域尺度合适、居中稳定，与标题框和页脚形成清楚安全区，所有轴标和标签均在页内。"
      },
      "evidence_requirement": "检查图表四边与灰底标题框、AIR Logo、显著性注释、页码和页面边缘的距离，报告任何裁切、碰撞或比例失衡。"
    },
    {
      "criterion_id": "V005",
      "description": "整页应保持原演示稿的信息层级和干净交付：灰底结论标题完整突出，AIR Logo、底部 `*p < .05...` 注释和页码均清楚，柱形图成为唯一被编辑的视觉主体；不得出现文字重排、缺图、截图压平、调试标记、重影或损坏渲染。",
      "weight": 1.6,
      "score_anchors": {
        "0": "标题、Logo、注释或页码缺失/严重变形，或页面压平、损坏、出现明显调试内容。",
        "0.5": "关键页面元素都在且能读，但标题—图表—页脚层级、清晰度或边缘清理有明显粗糙。",
        "1": "标题、图表和页脚层级与原稿一致，品牌/注释/页码清楚，页面边缘干净且达到可直接汇报的完成度。"
      },
      "evidence_requirement": "读取标题和底部显著性注释，核对 AIR Logo、页码、整页层级与边缘质量，并报告任何非图表区域的视觉变化。"
    }
  ]
}
