{
  "task_id": "cowork-evo/officeval-069-reference-guided-visual-editing",
  "rubric_version": "visual-v1",
  "enabled": true,
  "reference_mode": "reference",
  "candidate_artifacts": [
    {
      "path": "工商层面_流程图_框体字体调整版.pptx",
      "kind": "pptx",
      "label": "按截图标注修正 10 个目标框体与文字样式的可编辑治理流程图"
    }
  ],
  "reference_artifacts": [
    {
      "path": "solution/工商层面_流程图_框体字体调整版.pptx",
      "kind": "pptx",
      "label": "逐框根据参考标注统一尺寸、颜色、字体与换行的参考交付"
    }
  ],
  "criteria": [
    {
      "criterion_id": "V001",
      "description": "顶部 2021/2023/2025 三个时间节点应水平居中于各自色块下方；目标 2023 和 2025 框应与 2021 框保持同类浅蓝圆角矩形、深蓝边线、三行居中粗体与相当尺寸。",
      "weight": 1.7,
      "score_anchors": {
        "0": "2023/2025 中有框体缺失、严重过大/过小、文字截断，或仍与 2021 完全不同类。",
        "0.5": "三个时间框都可读且大体同类，但 2023/2025 在宽高、水平居中、圆角/边线、行距或三行换行中有明显不一致。",
        "1": "2023/2025 框与 2021 范例视觉同类，两者尺寸一致，三个框的基线、中心、边线、字重与三行文本节奏稳定。"
      },
      "evidence_requirement": "对比三个年份框的外边缘、中心线、填充/边线和每行文本，指明 2023、2025 是否与 2021 范例协调。"
    },
    {
      "criterion_id": "V002",
      "description": "阶段一的“林远航 持股 65% 发起投资”和“周予安 持股 35% 产业资源”应作为成对的浅蓝目标框，宽高、三行粗体、内边距和水平基线应一致。",
      "weight": 1.6,
      "score_anchors": {
        "0": "两个股东框有一个不可读/严重变形，或两者宽高、填充和字体完全不成对。",
        "0.5": "两框信息完整并大体对称，但在宽高、左右间隔、基线、边线、换行或字重中有明显偏差。",
        "1": "两个股东框形成稳定对称组，外框与三行文本的尺寸、对齐、字重和视觉重量一致。"
      },
      "evidence_requirement": "查看阶段一两个股东框的顶/底/左/右边缘、三行文字和下方连线入口。"
    },
    {
      "criterion_id": "V003",
      "description": "阶段二既有的“林远航 持股 55%”范例、目标“周予安 持股 30%”与阶段三目标“董事会决策层”三个浅蓝治理框，应共享约 4.45×2.08 厘米的视觉比例、深蓝线、居中粗体和整齐换行。",
      "weight": 1.7,
      "score_anchors": {
        "0": "三个框中有框严重变形/文字溢出，或相同层级的填充、线条和字体显著不一致。",
        "0.5": "三框信息都可读，但宽高/圆角、字号/字重、内边距、文本换行或对上/对下连线的中心中有两处以上偏差。",
        "1": "三个治理框保持同类尺寸与样式，文本居中且换行自然，并精准对齐各自的上下连线。"
      },
      "evidence_requirement": "分别指认阶段二两个蓝框和阶段三董事会蓝框，比较宽高、填充/线条、文字行及连线中心。"
    },
    {
      "criterion_id": "V004",
      "description": "仓配试点小组、日常运营链路、经营执行线和监督复核线四个目标应统一为浅粉圆角框、深粉边线与约 12pt 居中粗体，长文本应在三行内均衡排布。",
      "weight": 1.8,
      "score_anchors": {
        "0": "四个粉色目标中有两个以上严重过小/过大、文字溢出/截断，或样式完全不统一。",
        "0.5": "四个框均可见可读且使用粉色系，但尺寸、边线、字体、内边距、三行换行或对齐中有多处明显不一致。",
        "1": "四个粉色框的宽高、圆角、填充/边线、字重和文本垂直/水平居中一致，长文本无拥挤且与连线关系清楚。"
      },
      "evidence_requirement": "逐一查看四个粉框的外框宽高、三行文本、居中和上下/左右连线，特别检查“仓配试点小组”与“日常运营链路”的长文本换行。"
    },
    {
      "criterion_id": "V005",
      "description": "修改后的 10 个框应继续与时间线、三个阶段大框、公司主体、上下流箭头/连接线和未标注对象保持正确几何关系，不得因改大而重叠、挤压或造成流程断点。",
      "weight": 1.7,
      "score_anchors": {
        "0": "多个目标框遮挡阶段标题/其他框，三条主流程有两处以上连线无法追踪，或整页布局严重崩解。",
        "0.5": "三阶段与大部分连线可理解，但一到两个目标框与箭头不居中、间隔过紧，或尺寸变化破坏某一阶段的对称/留白。",
        "1": "所有目标框与时间线、大框、主体节点及连线精确对齐，三阶段的流程连续、布局均衡，未标注区域无异常漂移。"
      },
      "evidence_requirement": "从顶部时间线向下沿三个阶段各追踪一次节点/连线，指明目标框的中心、间隔、重叠和大框安全边距。"
    },
    {
      "criterion_id": "V006",
      "description": "整页应保持“智慧仓储运营主体治理演进”的三阶段阅读层级：主标题/副标题 -> 年份 -> 阶段标题 -> 主要流程框 -> 页脚，目标文字在全页尺寸下应清晰、无溢出且视觉专业。",
      "weight": 1.5,
      "score_anchors": {
        "0": "主标题/阶段标题或多个目标文本不可读，层级冲突严重，或出现参考截图标注、临时框等非交付元素。",
        "0.5": "主要内容都可读且三阶段可辨，但某些目标字号/行距、标题与阶段视觉重量、颜色关系或整页密度显得粗糙。",
        "1": "主标题、三个年份、三个阶段、10 个目标框和辅助文本都清晰可读，蓝/粉色语义分层克制，整页构图稳定且没有非交付标记。"
      },
      "evidence_requirement": "整页查看标题、副标题、三个年份/阶段、主流程框和页脚，并放大检查 10 个目标文本的字号、粗体、行距、溢出和统一性。"
    }
  ]
}
